{
  "policy_version": "0.7.1",
  "registry_file": "source-registry.json",
  "semantics": {
    "scheduled_candidate": "The source is applicable and receives its own immutable provider task before publication limits are applied.",
    "not_applicable": "The source is integrated but does not match this task's modes, task family, geography, or identified operator.",
    "configuration_required": "The source is integrated but needs a deployment endpoint, feed, or API configuration before it can receive a task.",
    "awaiting_trigger": "The dynamic official-source rule is integrated and becomes executable only after an operator or authority is discovered."
  },
  "source_policies": [
    {
      "source_id": "google-flights",
      "execution_kind": "ai_browser_offer_discovery",
      "admission_policy": "complete_metasearch_quote_or_research",
      "activation": "global_modes",
      "task_families": ["baseline", "market", "corridor_calendar", "budgeted_predecessor", "bridge", "refresh"]
    },
    {
      "source_id": "ita-matrix",
      "execution_kind": "ai_browser_research",
      "admission_policy": "research_then_seller",
      "activation": "global_modes",
      "task_families": ["baseline", "corridor_calendar", "budgeted_predecessor", "bridge", "refresh"]
    },
    {
      "source_id": "skyscanner",
      "execution_kind": "ai_browser_offer_discovery",
      "admission_policy": "seller_quote_or_research_then_seller",
      "activation": "global_modes",
      "task_families": ["baseline", "market", "corridor_calendar", "budgeted_predecessor", "bridge", "refresh"]
    },
    {
      "source_id": "kayak",
      "execution_kind": "ai_browser_offer_discovery",
      "admission_policy": "seller_quote_or_research_then_seller",
      "activation": "global_modes",
      "task_families": ["baseline", "market", "corridor_calendar", "budgeted_predecessor", "bridge", "refresh"]
    },
    {
      "source_id": "kiwi-com",
      "execution_kind": "ai_browser_offer_discovery",
      "admission_policy": "seller_quote_or_research_then_seller",
      "activation": "global_modes",
      "task_families": ["baseline", "market", "reverse", "corridor_calendar", "budgeted_predecessor", "bridge", "refresh"]
    },
    {
      "source_id": "trip-com",
      "execution_kind": "ai_browser_offer_discovery",
      "admission_policy": "seller_quote",
      "activation": "global_modes",
      "task_families": ["baseline", "market", "corridor_calendar", "budgeted_predecessor", "bridge", "refresh"]
    },
    {
      "source_id": "flightconnections",
      "execution_kind": "ai_browser_research",
      "admission_policy": "research_then_seller",
      "activation": "global_modes",
      "task_families": ["market", "reverse", "corridor_calendar", "bridge"]
    },
    {
      "source_id": "southwest",
      "execution_kind": "ai_browser_direct_operator",
      "admission_policy": "seller_quote",
      "activation": "identified_operator",
      "task_families": ["corridor_calendar", "budgeted_predecessor", "bridge", "refresh"]
    },
    {
      "source_id": "frontier",
      "execution_kind": "ai_browser_direct_operator",
      "admission_policy": "seller_quote",
      "activation": "identified_operator",
      "task_families": ["corridor_calendar", "budgeted_predecessor", "bridge", "refresh"]
    },
    {
      "source_id": "ryanair",
      "execution_kind": "ai_browser_direct_operator",
      "admission_policy": "seller_quote",
      "activation": "regional_market_or_identified_operator",
      "task_families": ["market", "corridor_calendar", "budgeted_predecessor", "bridge", "refresh"]
    },
    {
      "source_id": "airasia",
      "execution_kind": "ai_browser_direct_operator",
      "admission_policy": "seller_quote",
      "activation": "regional_market_or_identified_operator",
      "task_families": ["market", "reverse", "corridor_calendar", "budgeted_predecessor", "bridge", "refresh"]
    },
    {
      "source_id": "rome2rio",
      "execution_kind": "ai_browser_research",
      "admission_policy": "research_then_operator",
      "activation": "global_modes",
      "task_families": ["market", "bridge"]
    },
    {
      "source_id": "busbud",
      "execution_kind": "ai_browser_offer_discovery",
      "admission_policy": "seller_quote_or_research_then_operator",
      "activation": "global_modes",
      "task_families": ["corridor_calendar", "budgeted_predecessor", "bridge", "refresh"]
    },
    {
      "source_id": "trainline",
      "execution_kind": "ai_browser_offer_discovery",
      "admission_policy": "seller_quote_or_research_then_operator",
      "activation": "regional_modes",
      "task_families": ["corridor_calendar", "budgeted_predecessor", "bridge", "refresh"]
    },
    {
      "source_id": "ferryhopper",
      "execution_kind": "ai_browser_offer_discovery",
      "admission_policy": "seller_quote_or_research_then_operator",
      "activation": "regional_modes",
      "task_families": ["corridor_calendar", "budgeted_predecessor", "bridge", "refresh"]
    },
    {
      "source_id": "amtrak",
      "execution_kind": "ai_browser_direct_operator",
      "admission_policy": "seller_quote",
      "activation": "identified_operator",
      "task_families": ["corridor_calendar", "budgeted_predecessor", "bridge", "refresh"]
    },
    {
      "source_id": "greyhound",
      "execution_kind": "ai_browser_direct_operator",
      "admission_policy": "seller_quote",
      "activation": "identified_operator",
      "task_families": ["corridor_calendar", "budgeted_predecessor", "bridge", "refresh"]
    },
    {
      "source_id": "transitland",
      "execution_kind": "structured_research",
      "admission_policy": "topology_or_schedule_then_operator",
      "activation": "global_modes",
      "task_families": ["market", "reverse", "bridge"]
    },
    {
      "source_id": "gtfs",
      "execution_kind": "configured_structured_source",
      "admission_policy": "schedule_then_operator",
      "activation": "configured_source",
      "task_families": ["market", "reverse", "corridor_calendar", "budgeted_predecessor", "bridge", "refresh"]
    },
    {
      "source_id": "openstreetmap",
      "execution_kind": "structured_research",
      "admission_policy": "topology_only",
      "activation": "global_modes",
      "task_families": ["market", "reverse", "bridge"]
    },
    {
      "source_id": "opentripplanner",
      "execution_kind": "configured_routing_engine",
      "admission_policy": "route_then_operator",
      "activation": "configured_source",
      "task_families": ["market", "reverse", "corridor_calendar", "budgeted_predecessor", "bridge"]
    },
    {
      "source_id": "motis",
      "execution_kind": "configured_routing_engine",
      "admission_policy": "route_then_operator",
      "activation": "configured_source",
      "task_families": ["market", "reverse", "corridor_calendar", "budgeted_predecessor", "bridge"]
    },
    {
      "source_id": "valhalla",
      "execution_kind": "configured_routing_engine",
      "admission_policy": "route_then_operator",
      "activation": "configured_source",
      "task_families": ["market", "reverse", "bridge"]
    }
  ],
  "dynamic_rule_policies": [
    {
      "source_id": "carrier_official_site",
      "execution_kind": "dynamic_official_confirmation",
      "admission_policy": "seller_quote",
      "activation": "discovered_carrier",
      "task_families": ["corridor_calendar", "budgeted_predecessor", "bridge", "refresh"]
    },
    {
      "source_id": "operator_official_site",
      "execution_kind": "dynamic_official_confirmation",
      "admission_policy": "schedule_or_seller_quote",
      "activation": "discovered_operator",
      "task_families": ["corridor_calendar", "budgeted_predecessor", "bridge", "refresh"]
    },
    {
      "source_id": "open_transit_data",
      "execution_kind": "dynamic_structured_discovery",
      "admission_policy": "schedule_then_operator",
      "activation": "discovered_transport_authority",
      "task_families": ["market", "reverse", "bridge"]
    }
  ]
}
